{
  "$schema": "https://registry.tracy.ai/skills/schema/skill-record.schema.json",
  "namespace": "tracyhq",
  "slug": "wordpress-plugin-update-audit",
  "gitUrl": "https://github.com/TracyHQ/skills",
  "ref": "main",
  "skillPath": "skills/wordpress-plugin-update-audit",
  "platforms": ["wordpress"]
}
