{
  "$schema": "https://registry.tracy.ai/skills/schema/skill-record.schema.json",
  "namespace": "tracyhq",
  "slug": "skill-creator",
  "gitUrl": "https://github.com/TracyHQ/skills",
  "ref": "main",
  "skillPath": "skills/skill-creator",
  "platforms": [
    "wordpress",
    "woocommerce",
    "joomla",
    "shopify"
  ]
}
